<!ELEMENT patient_list (patient+, medicine+, doctor+)>
<!ELEMENT patient (patientFName, patientLName, gender)>
<!ATTLIST patient serialNo CDATA #REQUIRED>
<!ELEMENT patientFName (#PCDATA)>
<!ELEMENT patientLName (#PCDATA)>
<!ELEMENT gender (#PCDATA)>

<!ATTLIST medicine medID ID #REQUIRED>
<!ATTLIST doctor docID ID #REQUIRED>

<!ELEMENT medicine (name, manufacture, regNo)>
<!ELEMENT name (#PCDATA)>
<!ELEMENT manufacture (#PCDATA)>
<!ELEMENT regNo (#PCDATA)>

<!ELEMENT doctor (registration, fName, lName, specialisation)>
<!ELEMENT registration (#PCDATA)>
<!ATTLIST registration ID CDATA #REQUIRED>
<!ELEMENT fName (#PCDATA)>
<!ELEMENT lName (#PCDATA)>
<!ELEMENT specialisation (#PCDATA)>